{
  "schema_version": "1.0.0",
  "review_version": "b3-2026-08-28",
  "reviewed_at": "2026-08-28T06:00:30Z",
  "live_adapters_enabled": false,
  "publication_boundary": {
    "raw_data_commit": "Commit only official open-data fixtures with attribution; contract feeds and bulk archives stay out of the repository.",
    "github_pages": "Publish evidence metadata, citations, fixtures, and expressly reusable summaries only; licensed prices, holdings, and index values stay off Pages.",
    "secrets": "Credentials belong only in GitHub Actions repository/environment secret stores, never repository files or browser assets."
  },
  "sources": [
    {"source_id":"TWSE_OGL_COMPANY","publisher":"Taiwan Stock Exchange","countries":["TW"],"data_classes":["listing_metadata"],"documentation_url":"https://data.gov.tw/dataset/18419","access_method":"Documented TWSE OpenAPI /opendata/t187ap03_L only; generic TWSE/MOPS HTML crawling is excluded.","authentication":"none","key_required":false,"rate_limit":"No numeric limit is documented; identify the client, retrieve sequentially, cache snapshots, and back off on errors.","history_depth":"Current published company snapshot; complete revision history is not promised.","point_in_time_status":"partial","license_status":"open_with_attribution","license_url":"https://data.gov.tw/license","retention":"Versioned normalized snapshots may be retained with attribution and retrieval time.","redistribution":"Raw and adapted OGL records may be redistributed with attribution.","pages_policy":"raw_with_attribution_allowed","feasibility":"conditional","fallback":"Manual official issuer identity review.","gaps":["No immutable correction stream or complete historical identity vintages."]},
    {"source_id":"TWSE_OGL_FINANCIALS","publisher":"Taiwan Stock Exchange","countries":["TW"],"data_classes":["filings_financials"],"documentation_url":"https://data.gov.tw/dataset/91998","access_method":"Documented TWSE OpenAPI monthly revenue plus separate general-industry and financial-holding income-statement and balance-sheet endpoints; no MOPS HTML scraping.","authentication":"none","key_required":false,"rate_limit":"No numeric limit is documented; retrieve sequentially with a declared User-Agent, at least two seconds between requests, caching, and backoff.","history_depth":"Current monthly and quarterly published snapshots; every observed version must be archived for future PIT use.","point_in_time_status":"partial","license_status":"open_with_attribution","license_url":"https://data.gov.tw/license","retention":"Normalized OGL facts and response hashes may be retained with attribution; raw full-market payloads are not committed.","redistribution":"Normalized facts may be published with OGL attribution and source links.","pages_policy":"raw_with_attribution_allowed","feasibility":"conditional","fallback":"Official issuer releases as manual cross-checks; a separately licensed feed is required for complete PIT backfill.","gaps":["Historical revisions, correction semantics, taxonomy drift, and complete PIT backfill are not provided by the current snapshot endpoints."]},
    {"source_id":"TWSE_OGL_EOD","publisher":"Taiwan Stock Exchange","countries":["TW"],"data_classes":["eod_prices"],"documentation_url":"https://data.gov.tw/dataset/11549","access_method":"Documented TWSE OpenAPI /exchangeReport/STOCK_DAY_ALL and /exchangeReport/BWIBBU_ALL; no generic HTML scraping.","authentication":"none","key_required":false,"rate_limit":"No numeric limit is documented; identify the client, retrieve sequentially, use at least two seconds between requests, cache ETag/Last-Modified, and back off.","history_depth":"Current daily market and valuation snapshots; the official historical UI is not an approved bulk API.","point_in_time_status":"partial","license_status":"open_with_attribution","license_url":"https://data.gov.tw/license","retention":"Observed OGL snapshots and response hashes may be retained with attribution.","redistribution":"OGL records and normalized facts may be redistributed with attribution.","pages_policy":"raw_with_attribution_allowed","feasibility":"conditional","fallback":"Separately licensed historical market-data feed.","gaps":["No verified OGL full-history API, total-return series, or immutable correction stream."]},
    {"source_id":"TWSE_OGL_ACTIONS","publisher":"Taiwan Stock Exchange","countries":["TW"],"data_classes":["corporate_actions"],"documentation_url":"https://data.gov.tw/dataset/89748","access_method":"TWSE OpenAPI ex-right/ex-dividend snapshots","authentication":"none","key_required":false,"rate_limit":"Not documented; cache and back off conservatively.","history_depth":"Current and forecast snapshots; complete action history is not documented.","point_in_time_status":"partial","license_status":"open_with_attribution","license_url":"https://data.gov.tw/en/license","retention":"Preserve every observed version with retrieval time.","redistribution":"OGL snapshots may be redistributed with attribution.","pages_policy":"raw_with_attribution_allowed","feasibility":"conditional","fallback":"Issuer notices, filings, then a licensed golden source.","gaps":["Not a complete split, rename, suspension, and delisting golden source."]},
    {"source_id":"TWSE_OGL_ETF","publisher":"Taiwan Stock Exchange","countries":["TW"],"data_classes":["listing_metadata","etf_fund_data"],"documentation_url":"https://data.gov.tw/dataset/157399","access_method":"Documented TWSE OpenAPI /opendata/t187ap47_L ETF fund-profile snapshot; no generic HTML scraping.","authentication":"none","key_required":false,"rate_limit":"No numeric limit is documented; retrieve sequentially with a declared User-Agent, at least two seconds between requests, caching, and backoff.","history_depth":"Current monthly snapshot; immutable historical versions are not promised.","point_in_time_status":"partial","license_status":"open_with_attribution","license_url":"https://data.gov.tw/license","retention":"Observed OGL snapshots may be retained with attribution.","redistribution":"OGL metadata may be redistributed with attribution.","pages_policy":"raw_with_attribution_allowed","feasibility":"conditional","fallback":"Official issuer product pages as metadata-only references.","gaps":["No complete PIT holdings, NAV, premium-discount, or benchmark-return history."]},
    {"source_id":"SITCA_OGL_ETF","publisher":"Securities Investment Trust and Consulting Association","countries":["TW"],"data_classes":["etf_fund_data","filings_financials"],"documentation_url":"https://data.gov.tw/dataset/11109","access_method":"Official ETF NAV open-data files plus fee datasets","authentication":"none","key_required":false,"rate_limit":"Not documented; one daily cached retrieval is sufficient.","history_depth":"Current published files; complete historical retention is not promised.","point_in_time_status":"partial","license_status":"open_with_attribution","license_url":"https://data.gov.tw/en/license","retention":"Observed OGL snapshots may be retained with attribution.","redistribution":"OGL records may be redistributed with attribution.","pages_policy":"raw_with_attribution_allowed","feasibility":"conditional","fallback":"Issuer filings and a licensed fund-data source.","gaps":["No complete holdings, AUM, fee, and NAV vintage archive."]},
    {"source_id":"TWSE_OGL_CALENDAR","publisher":"Taiwan Stock Exchange","countries":["TW"],"data_classes":["market_calendar"],"documentation_url":"https://data.gov.tw/dataset/11761","access_method":"Annual TWSE holiday schedule","authentication":"none","key_required":false,"rate_limit":"Annual retrieval is sufficient.","history_depth":"Latest annual schedule; archive each version.","point_in_time_status":"partial","license_status":"open_with_attribution","license_url":"https://data.gov.tw/en/license","retention":"Annual versions may be retained with attribution.","redistribution":"OGL calendar records may be redistributed with attribution.","pages_policy":"raw_with_attribution_allowed","feasibility":"ready","fallback":"Manually versioned official schedule.","gaps":["Historical versions are not guaranteed by the endpoint."]},
    {"source_id":"TWSE_OGL_BENCHMARK","publisher":"Taiwan Stock Exchange","countries":["TW"],"data_classes":["benchmark"],"documentation_url":"https://data.gov.tw/dataset/11755","access_method":"TAIEX daily OHLC open-data snapshots","authentication":"none","key_required":false,"rate_limit":"Not documented; cache and back off conservatively.","history_depth":"Latest-month style snapshots; no verified OGL full backfill.","point_in_time_status":"partial","license_status":"open_with_attribution","license_url":"https://data.gov.tw/en/license","retention":"Observed OGL snapshots may be retained with attribution.","redistribution":"TAIEX price-index observations may be published with attribution.","pages_policy":"raw_with_attribution_allowed","feasibility":"conditional","fallback":"Licensed price or total-return index history.","gaps":["Dataset 11755 does not establish total-return coverage."]},